,title,url,review
46,On the Rocks,https://www.imdb.com/title/tt9606374/reviews?ref_=ttls_li_tt,"This very recently became available on Apple TV so my wife and I watched it as soon as it did, streaming via Roku.This is your basic dad and adult daughter caper, she is happily married with two kids in New York but feeling a bit underappreciated by her hard working husband. When she shares an incident with her dad he decides the husband must be cheating and sets out to have him followed. The two of them even follow him to Mexico where he is traveling for business.The dad is wealthy playboy Felix, played by 70-ish Bill Murray and he does it well. The daughter is 44-ish Rashida Jones as Laura, an author unable to get unstuck. Her husband is played well by 48-ish Marlon Wayans as Dean. While the movie in general is executed well and the acting appropriate, I found the story a bit too far-fetched and thus had trouble getting into it. My reaction when it was over was sort of ""so what?""Just a very inconsequential movie that is somewhat entertaining."
47,Skull: The Mask,https://www.imdb.com/title/tt8447170/reviews?ref_=ttls_li_tt,"A low budget supernatural slasher flick from Brazil, SKULL sees an ancient executioner mask coming back to the present day, where it possesses one of its victims and goes on a killing spree. That's all the plot you're getting in this dark and grimy production which goes for all-out constant gore and ends up numbing the viewer not long in. It's a little like the HATCHET films in their single-minded determination to deliver kill after kill, and it is excessively gory, but these days I like something a little more than that from my horror."
48,Walker,https://www.imdb.com/title/tt11006642/reviews?ref_=ttls_li_tt,"This is not really a re-boot of the 1993 long-running TV series ""Walker, Texas Ranger"", with Chuck Norris. Instead it is a ""re-imagining"" of the same character, younger and with children. The old Walker was always at the top of his game, this Walker often seems confused as to what his game really is.Jared Padalecki (also Producer) doesn't bring the same set of skills that Norris did but is a San Antonio native and at 38 is a bit younger than Norris was. He is a good-looking young man but his acting chops are a bit suspect for this kind of role. He must learn the difficult art of being a single parent to two teens. After several episodes my wife and I have a very lukewarm feeling about the series. Something about it doesn't quite feel genuine.Some have questioned the hats. It is an integral part of the uniform for Texas Rangers. To be dressed appropriately, Rangers are required to wear a western hat, a dress shirt, a tie, a dress coat, appropriate pants, western belt, western boots, and the official Texas Ranger badge pinned above the left shirt pocket. An approved handgun should be worn in a waist holster at all times.So my synopsis is ... interesting start, but it is slow to develop much impact, we might quit watching it every week. Once you focus on the fact that stories like this are fictional, just a product of the writer's mind, you keep watching because the characters are interesting and here they aren't that interesting."
49,Warning,https://www.imdb.com/title/tt8956324/reviews?ref_=ttls_li_tt,"The story takes place in the near future or so. Thunder Storms are disrupting life and some electronics that humans rely upon. An astronaut (Thomas Jane) and not a robot is attempting to repair a satellite when an electronic buzz blows him back and appears to disrupt the satellite. Meanwhile storm clouds continue in outer space around the planet. We follow a number of disconnected lives on the planet and their relationship with technology. We discover some folks can live forever, while others can not. Androids are used for companions.The ending brings things together, but not too well. There is a message somewhere in all of this, the problem being there are too many messages and they are confused.Guide: F-word. Sex. Brief nudity (Garance Marillier)"
50,Good Witch,https://www.imdb.com/title/tt3906732/reviews?ref_=ttls_li_tt,"This is sort of a 'Sabrina' meets 'Gilmore Girls' Hallmark show that's passable, it's enjoyable enough, but didn't do a lot for me."
51,Snakehead,https://www.imdb.com/title/tt4181232/reviews?ref_=ttls_li_tt,"Now, I wasn't really sure what I was in for here, as I sat down to watch the 2021 movie ""Snakehead"". But still, with ""Snakehead"" being a movie that I hadn't already seen, of course I found the time to sit down to watch it.And as it happens to turn out, then ""Snakehead"" was actually rather enjoyable. Writer and director Evan Jackson Leong managed to put together a very interesting and entertaining storyline where there were many ups and downs along the way, making it a non-linear ride. And Evan Jackson Leong also managed to put together a group of interesting and very detailed characters, along with some good and believable dialogue. And I will say that it was nice to see the writer and director take an alternate approach to showcasing human trafficking and a crime syndicate in China Town.So yeah, I was genuinely entertained by what ""Snakehead"" delivered.It should be noted that the movie's cover is very much reminiscent of an 1990s action movie, which sort of is presenting a wrong presentation of the movie. So don't let the movie slide your interest just because of the cover.The movie has an all-together impressive ensemble of casted actors and actresses. The movie was especially nicely carried by the performances of Shuya Chang (playing Sister Tse) and Jade Wu (playing Dai Mah). But also with the likes of Sung Kang and Yacine Djoumbaye, then you are in for an entertaining movie with good performances.While ""Snakehead"" is listed as an action crime drama, which it essentially is, the main focus of the movie is the crime and the drama, whereas the action is just an added layer.I can warmly recommend that you sit down to watch ""Snakehead"", if you have the chance. I was genuinely entertained by it, and it turned out to be a movie that sinks in under the skin.My rating of ""Snakehead"" lands on a six out of ten stars."
