,title,url,review
22,Tides,https://www.imdb.com/title/tt6506264/reviews?ref_=ttls_li_tt,"The Earth became uninhabitable after various devastations. The elites moved off world to another planet. After two generations, they sent two missions to investigate a possible return to Earth. The first mission goes missing. Louise Blake is part of the Ulysses 2 crew. Her father is the captain of Ulysses 1.Apparently, infertility has something to do with the planets or something like that. How does that work? I don't understand the science of it all. The movie needs to explain it since it's such a big part of the plot. The movie would work better without that idea anyways. The collecting of girls is always creepy and this story doesn't need it. I actually really like the first half a lot. The second half is a bit of a bummer when it tries to do what it does."
23,The Flash,https://www.imdb.com/title/tt3107288/reviews?ref_=ttls_li_tt,"Review of Season One:THE FLASH is another addition to the DC Comics universe, and very similar in scope to ARROW. However, I found this season to be slightly preferable to ARROW; it doesn't have that po-faced seriousness that ARROW has going on, and the characters are more likeable as a result. It's generally a villain of the week kind of picture, although there is a mildly engaging storyline that emerges and comes to fruition towards the climax. The performers are generally confident and ambitious, which helps a lot, although the CGI effects leave something to be desired and there's a certain constraint and repetitive nature to the action scenes due to the superhero's power and in this respect ARROW is the superior show. I was delighted to see some genre favourites, including Liam McIntyre and Clancy Brown, appearing in support.Review of Season Two:Season 2 is a bit of a mixed bag but still generally enjoyable. The writing isn't as strong or consistent as in the first series so it becomes more of a villain-of-the-week kind of format. Some of the other superhuman characters make fun appearances but there's a lack of good guest stars compared to the first season. The supporting cast tend to come into her own here which keeps this watchable.Review of Season Three:Season 3 takes a few more missteps than previously but still proves generally enjoyable. The main problem with this one is the weaker writing, with much more needless family melodrama and a lack of genuine suspense. The constant time travel storylines simply aren't as interesting as those of the previous two series, and the recasting of Wells as a comedy character becomes a little grating. By far the nadir of this season is the ridiculous song-and-dance episode complete with the bloody John Barrowman, no less; what were they thinking?Review of Season Four:Sadly, Season 4 proves to be the worst yet, a mish mash of ideas and tropes that never really gels. The first half of the series is pure filler as Barry gets sent to prison which doesn't really make sense when it comes to the fantasy and sci-fi elements found elsewhere. The obnoxious comedy with Harry's alter egos and the endless romantic elements drag the pacing down considerably. The inclusion of the bendy guy is ridiculous and not helped by appalling CGI effects. The series' villain is a predictable chap borrowed from Marvel and the final element a simple MATRIX copy with more bad FX. A shame that a once-promising show is now becoming so tedious."
24,The Haunting of Bly Manor,https://www.imdb.com/title/tt10970552/reviews?ref_=ttls_li_tt,"Henry Wingrave hires American Dani Clayton to care for his orphaned nephew and niece at an English country estate called Bly Manor. She joins a staff which includes chef Owen Sharma, groundskeeper Jamie and housekeeper Mrs. Grose.This second season of the Netflix anthology goes to a different place. It doesn't have the scares as the first season. It's a bit creepy but I'm not really drawn into the mystery. It's a basic ghost and possession story. I like the actors. The kids are creepy. It doesn't intriguing as much as the first season and it falters by the comparison. It's still good TV but it is a sophomore slump."
25,Wild Bill,https://www.imdb.com/title/tt9118930/reviews?ref_=ttls_li_tt,"Bill Hixon is a US Police Chief who has just taken a new job in Boston... not the Boston in Massachusetts but the original in Lincolnshire! Here he is to take over as the Chief Constable of the fictional East Lincolnshire Constabulary. It soon becomes clear that it won't be an easy job; he isn't particularly welcome, with locals fearing he has been brought in to cut costs and thus jobs. Over the course of the series he will have to investigate a variety of crimes; most of which aren't of the type that would feature in a typical US cop show! If that weren't enough he has a fourteen year old daughter who must also settle into a new life far from home.It is clear from the start that this will be a fairly silly series... the very first scene sees our protagonist chase crooks into a cabbage field and start throwing cabbages in frustration! While this isn't a problem there are details that will irritate some viewers... notably the fact that most of the 'locals' have Yorkshire accents and the fact that the way the police behave is very unrealistic; no Chief Constable would lead investigations and junior officers certainly wouldn't get away with talking to him the way they do here. Perhaps a little strangely these flaws didn't bother me as much as I'd expected. The stories are fun but not without their darker moments. Rob Lowe is the undoubted star of the show; doing a fine job as our protagonist; there is solid support from Bronwyn James as DC Muriel Yeardsley, the one local copper who seems to get on with Hixon; young Aloreia Spencer, who impresses as his daughter Kelsey; and Rachel Stirling, as local judge Lady Mary Harborough. The series ends with what I thought was its best episode; this wraps up some storylines but leaves others open for a future series... if there is more I'll watch. Overall I'd say that while this isn't the best British cop show I'd still recommend trying it as different to most shows and set in part of the country rarely seen on television."
26,Bergman Island,https://www.imdb.com/title/tt6910282/reviews?ref_=ttls_li_tt,"It's a movie that includes the great Bergman praises and critiques, as well as a terrific Bergman safari.A great cinematic experience that increases the pleasure of watching with its screenplay that makes the movie out of Bergman's prisoner with two very beautiful stories.This is the first movie of the director/screenwriter that I watched.He also managed to arouse curiosity about himself."
27,The Blazing World,https://www.imdb.com/title/tt11378876/reviews?ref_=ttls_li_tt,"The story is weird, and doesn't make much sense. The first half is too long, and the second half is too short. However, the ending doesn't make sense, and is very confusing. Overall, the film is slow, fragmented and confusing."
28,Needle in a Timestack,https://www.imdb.com/title/tt7099280/reviews?ref_=ttls_li_tt,"Nick (Leslie Odom Jr.) and Janine (Cynthia Erivo) are a couple. Nick is concerned that Tommy (Orlando Bloom), Janine's ex-husband will travel back in time and change the past so he can stay with her. Then it happens. Or something happens and Nick is married to his ex-girlfriend, his sister's friend did not die and Tommy is with Janine and he is torn between trying to get her back in this time or another time or not doing anything at all. Did anybody kill Hitler as a baby?The film is far more drama than science fiction. It wasn't a very good screen adaptation and maybe should have stayed as a short story. Needed better direction and editing.Guide: F-word. No sex or nudity."
29,Freshman Year,https://www.imdb.com/title/tt11618536/reviews?ref_=ttls_li_tt,I find the film slow and boring. They just talk and talk. Nothing happens.
30,Old,https://www.imdb.com/title/tt10954652/reviews?ref_=ttls_li_tt,"Guy (Gael García Bernal) and his family have been given an exotic resort vacation. They and other guests are brought to a secluded closed beach. Soon, they realize that the kids are growing older by years and nobody can escape.Like a lot of M. Night Shyamalan movies, he has a fascinating idea and a twist. The idea is really good. The twist explains some of the idea but in reality, it's not actually necessary. It would be more compelling to have the group stumble upon a mini Bermuda triangle from which no one can escape. As for the group, I do have an issue with them not doing everything to try to escape. They often feel stuck by their own inaction. The only one truly figuring out stuff seems to be Jarin. What got me is when Kara tries to climb out. Instead of helping, almost everyone is trying to stop her and stop Trent from joining her. First of all, one of the adults should have tried climbing before then. I also wonder why they don't try to tie together a rope or MacGyver something. The pool noodles are meant to be funny but I just wondered why that's the first time we're shown them. Then there is the passing out bit. The story yadayada a lot of that away. Nevertheless, I still like the idea. It's a fun Twilight Zone episode. M. Night continues to do the twist at the end and this one is fine. This is interesting."
31,Snake Eyes,https://www.imdb.com/title/tt8404256/reviews?ref_=ttls_li_tt,It's the origins of G. I. Joe team member Snake Eyes (Henry Golding). Nobody asked for this. Nobody is really looking for this. The story is fine. It's a functional origins story if somewhat uninspired. Golding is fine. The actors are all fine. The action is fine but the constant CG work does make it repetitive. The last act drags as the repetitive action goes on and on. This is trying to set up for more G. I. Joe movies but that is unlikely to be successful.
32,Honey Girls,https://www.imdb.com/title/tt11847606/reviews?ref_=ttls_li_tt,"A great film showcasing the chance that some lucky youngsters get, if picked , in a hard place to make it , if the 3 girls are actually a group , I hope they stick together and make it."
33,Last Man Down,https://www.imdb.com/title/tt12335692/reviews?ref_=ttls_li_tt,"John Wood (Daniel Stisen) is in special ops during a pandemic that wipes out most of Europe as people flee to the north and live in small communities. He has a falling out with Commander Stone (Daniel Nehme) and manages to escape to the mountains where he lives in an isolated cabin. An injured woman (Olga Kent) arrives at his cabin. He cares for her and discovers that her blood is the cure for the virus which is why they want her. She doesn't want big pharma to control the cure, she wants to give it to the people, a rather muddied plot point. Most of the film is our happy Nordic couple fighting semi-Rambo style against armed forces. It is an action movie with a pandemic background. It even include the final one on one giant vs giant fight at the end. Very cliche.The first thing I noticed was there was some dubbing. In an early scene where one fighter after another approaches John, there all say something. And every one had the same identical voice. It is a Rambo light type of fun.Guide: F-word. Rear nudity."
34,No Man of God,https://www.imdb.com/title/tt13507778/reviews?ref_=ttls_li_tt,"FBI agent Bill Hagmaier (Elijah Wood) interviews serial killer Ted Bundy (Luke Kirby) who is on death row.This movie has limited tension. In the first part of this, Bill really has no specific goal other than just talking with Bundy. He is only in danger of getting killed by the mass murderer. He needs a specific goal but his mission is specifically goalless. It's an interesting performance from Luke Kirby. There isn't much in terms of plot. They do introduce a ticking clock in the last section but the stakes are never elevated. If they need to give peace to these families, then they should have somebody show how troubled they are. They need to elevate the intensity."
35,Superman and Lois,https://www.imdb.com/title/tt11192306/reviews?ref_=ttls_li_tt,"I am writing this after the first four episodes of this new TV series. To be successful a series needs both good stories and interesting characters and this one has both.As the series starts Clark and Lois have fraternal twin teenage sons who don't yet know their father is Superman. They decide to move from Metropolis and return to the Kent farm in Smallville. As the story lines are developing one of the boys starts to show unusual abilities and his parents must tell the sons the whole story.As episode four ended we see a wealthy businessman who just bought mineral rights of an old mining operation in Smallville apparently has a lode of Kryptonite and this promises to become the new villain for Superman.So far a good, entertaining series, one-hour (with commercials) episodes on Monday nights on the WB."
36,Tiger,https://www.imdb.com/title/tt12688688/reviews?ref_=ttls_li_tt,"They all capture so well (including this one) is the complex, complicated truth of an individual. I do wonder, though, if the ending triumph of ""Tiger"" is just more of what the film is trying to combat: the public's desire to see perfection in a person."
37,The Asset,https://www.imdb.com/title/tt6079772/reviews?ref_=ttls_li_tt,"Moody (Samuel L. Jackson) is a professional assassin and Anna (Maggie Q) is his protégé. They return to London after killing and stealing from a notorious gangster. She runs an antique book store and one day, the mysterious Rembrandt (Michael Keaton) walks in.This had some fun while Jackson remains on the screen. I thought he and Maggie Q work as a comedic action duo. She's the straight man. She doesn't talk much and Jackson can bounce anything off of her. The movie really loses something when it loses him. It becomes a derivative silent assassin movie when early on, it promised to be a fun irreverent blow-em-up movie. While he's gone, the movie feels like it lost something and it never really recovers it even after the reveal. This probably works better as a buddy killer comedy."
38,Good Joe Bell,https://www.imdb.com/title/tt4651466/reviews?ref_=ttls_li_tt,"Joe Bell's (Mark Wahlberg) son Jadin (Reid Miller) was bullied at school in Oregon for being gay and killed himself. Joe decides to walk across America and give talks at High School to raise awareness. Joe talks to his dead son along the way. He feels guilty for his death because he never told his son it was okay. Joe's is a very bad public speaker with a message that seemed like ""Bullying is bad, M'kay."" He does better witnessing one on one or in small groups. The film was suddenly cut short. Note to self: Better to fly across America. Very depressing and boring.Guide: F-word. No sex or nudity."
39,Knocking,https://www.imdb.com/title/tt10928086/reviews?ref_=ttls_li_tt,"After leaving a tragic accident - the film begins with our heroine embracing her girlfriend who runs into the water and is never seen again - and a stay at the mental hospital, Molly moves into a new apartment where a strange knocking keeps on getting louder and louder. No one else can hear it. And it's not going away.Adapted from a novel by Johan Theorin, this movie lives and dies by the intense performance of lead Cecilia Milocco and the so tight you're face-to-face cinematography of Hannes Krantz. The tension keeps increasing and much like so many ""is it supernatural or mental illness"" movies, the questions keep increasing as Molly begins taking increasing risks to determine where the knocking and sobbing is coming from.At just 78 minutes, this is a short film that nearly begs for even more time and it's rare that I feel that way. The end just arrives after the slowest of builds, but I've been obsessed with the moments that exist between waiting for something to happen and the actual second that everything changes."
40,Injustice,https://www.imdb.com/title/tt5012504/reviews?ref_=ttls_li_tt,"Normally I am not a fan of the 'what if' takes on already established comic characters, and I didn't know what the 2021 DC animated feature ""Injustice"" was one such story. But still, I opted to sit down to watch it with my son, as he enjoys superheroes. Whereas I can watch movies with superheroes, but it is not my first choice, as I find superheroes a bit bland.Writers Ernie Altbacker and Tom Taylor actually managed to put together an entertaining storyline. Sure, it was generic in terms of something like this has been seen and done before, many times over. But the storyline told in ""Injustice"" actually proved interesting given the deaths of villains and superheroes alike, as well as the sheer amount of violence and fighting that took place.The art style in ""Injustice"" was good and fluid, and that definitely added to the overall enjoyment of the whole thing. There was a slight touch of good old 1980s cartoon over it, while it managed to be fresh and modern, without it succumbing into a child-like art style, such as seen in the ""Teen Titans Go"" and such.With ""Injustice"" being an animated feature, then having a good voice acting ensemble is alpha and omega. And luckily they had a great ensemble put together for performing the voices for this animated movie. I didn't recognize a single voice though, and having looked through the cast list after the movie ended, I wasn't really familiar with a single performer, for better or worse.""Injustice"" actually turned out to be a nice surprise, and certainly one of the more enjoyable of DC animated movies, if you ask me. I liked the dark and gritty feel it had, the violence and mayhem, and the fact that it was aimed at an adult audience.My rating of ""Injustice"" lands on a six out of ten stars."
41,"Introducing, Selma Blair",https://www.imdb.com/title/tt14030526/reviews?ref_=ttls_li_tt,"SXSW 2021
Greetings again from the darkness. Whether it's navigating the stairs on all fours, getting a boost up to the saddle of her beloved horse, or showing off her glittery turbans and walking canes, the showmanship of actress Selma Blair seems ever-present despite the severe effects of her Multiple Sclerosis (MS). Documentarian Rachel Fleit films the daily challenges faced by Ms. Blair as she comes to grips with the disease and its impact on her career, her life, and her ability to raise her son.You likely recognize Selma Blair from her most popular movies, CRUEL INTENTIONS (1999) and LEGALLY BLONDE (2001). She admits to viewing herself as a supporting actor, rather than a star, but with 80 screen credits over 25 years, she's certainly worked consistently. But here we see her daily physical and emotional struggles, though her sense of humor is present except for the darkest moments. Cracking wise about Kim Kardashian or Norma Desmond (SUNSET BLVD), and never hesitating to ensure her cane serves the dual purpose of fashion accessory, Ms. Blair keeps us constantly guessing as to whether she is serving up raw emotions or her best performance in the moment.We can easily forgive her if a bit of her good humor is an act. It seems clear the film is designed to be a ""gift"" to her young son Arthur, should her life be cut short. Early on, we witness an MS episode when the stimulus gets to be too much. Her physical contortions and impaired speech are difficult to watch, but necessary for us to fully understand the brutality of the disease.Half of the film is dedicated to her decision to seek stem cell treatment. The process is long and arduous, and we are spared much of the worst that she experiences. Still, it's a weeks-long cycle followed by a two year recovery, with no guarantee of improvement. In fact, no miracle cure or recovery occurs, and Ms. Blair initially seems shocked that she has two years of recovery ahead. It's difficult to believe she had not previously been informed.Selma Blair's slogan, ""We have so much time to be dead"", is a terrific message and she's to be commended and respected for opening up her challenges to the camera. It's hopeful that her willingness to do so will help others, while also educating those unfamiliar with this disease. Mommy issues and extra drama aside, this film is quite something to experience."
42,The Suicide Squad,https://www.imdb.com/title/tt6334354/reviews?ref_=ttls_li_tt,"Harley Quinn (Margot Robbie) is back with the Suicide Squad. Amanda Waller (Viola Davis) blackmails Bloodsport (Idris Elba) onto the team. Along with Peacemaker (John Cena), Ratcatcher 2, Polka-Dot Man, King Shark (Sylvester Stallone), and Colonel Rick Flag (Joel Kinnaman), the group is tasked with infiltrating the island state of Corto Maltese after a military coup to take out an alien starfish.This is a sequel to Suicide Squad (2016). James Gunn takes over as writer and director. It has all of his irreverent style. It is fun, colorful, and violent. It's a candy-coated punch in the face and kiss on the cheeks. It's very enjoyable and an improvement from the first movie. There is an issue with this franchise. The group is not stable. The only constant is probably going to be Amanda Waller and nobody likes her. Harley Quinn has been in both movies but her public pull is still in doubt. It makes it hard to build a continuing narrative for the franchise. This is a great stand-alone movie although the franchise is a different question."
43,Don't Breathe 2,https://www.imdb.com/title/tt6246322/reviews?ref_=ttls_li_tt,It's 8 years after the first movie. The original house has been burnt down. The Blind Man (Stephen Lang) is raising young Phoenix (Madelyn Grace) in a different isolated house. He's overly protective. A creepy man takes an interest in Phoenix and follows her back home with his gang of thugs.I don't mind the first half of the movie. It's interesting to see the story from the other side. I don't like the revelations in the second half of the movie. They are either too convenient or too unlikely. Why can't he just be a creepy child trafficker? The other issue is that the story should stay in that house. The Blind Man should have a way to turn off all the lights in his own home. I really like sneaking around although I don't know how long that could last. I'd rather find out than doing what this movie does in the second half.
44,Stillwater,https://www.imdb.com/title/tt10696896/reviews?ref_=ttls_li_tt,"Bill Baker (Matt Damon) is one of the struggling underclass living in Stillwater, Oklahoma. His oil rig job is gone and he's doing a lowly cleanup job after a tornado. He's respectful to everybody, has two guns, and prays before every meal. Money is tight. He was a bad absentee father but he travels to Marseille, France to visit his daughter Allison (Abigail Breslin) who is in prison for murdering her girlfriend. She claims to be innocent. Bill has a suspect but no one is willing to help. He befriends a young girl named Maya and her mother Virginie (Camille Cottin) helps him as his translator.First, the elephant in the room is the complaint by Amanda Knox. She's entitled to her feelings and I'm sure that it feels bad to have other people take advantage of her story. While this story has some similarities, there are big differences from her story. In addition, this is the father's story more than the daughter's story. Amanda may feel exploited but at best, she is the starting inspiration for the writing of this story.The most compelling aspect is to make this MAGAian character as a sympathetic lead. The world is grinding him down but he still struggles on. He is Sisyphus. Their mantra becomes Life is Brutal. For the movie's first 2/3, his struggling to save his daughter is very compelling. His friendship with Maya is very sweet. The better way to wrap this up would be a sweet tragic turn with Maya. The turn it actually does is too convenient, too setup by the movie, and the movie had moved on. It clashes but I'm willing to live with it until the further twist comes. The twist is a real problem and it retroactively destroys some of the movie's first 2/3. Breslin would be acting differently and her explanation is a little light. It screws up an otherwise great movie."
45,New Amsterdam,https://www.imdb.com/title/tt7817340/reviews?ref_=ttls_li_tt,"Wow, Mrs. Shullivan and I binged watch the first four (4) episodes of this new TV medical drama series. Of course it is inspirational as well as brimming with emotional storylines in which the majority of the medical professionals are in their mid-30s including the new hire administrator of the New Amsterdam hospital. a doctor named Dr. Max Goodwin (Ryan Eggold).We haven't seen even a tinge of any humor in this TV series to lighten the mood at New Amsterdam. No, quite the contrary, the gas pedal is floor to the metal, as there are quite a few miraculous diagnosis and lengthy Operation Room surgeries and unlike any medical emergency hospital I have ever seen, no one ever gets a bill for their life saving surgery. I have sometimes fallen into a dream sequence reminiscent of all the teary eye miracles and goodwill emphasized on another inspirational TV series, that being Touched by an Angel, 1994-2003.Okay, okay, the results are not real miracles at the New Amsterdam hospital but we can all dream can't we?"
